{
  "verifier": {
    "id": "medagent.verifiers.find_skills_quality_v1",
    "version": "0.1.0"
  },
  "target": {
    "evidence_pack": "examples/evidence_packs/find_skills_trusted_pass/skill_run",
    "skill_id": "medagent.find_skills",
    "source_overall_status": "passed"
  },
  "selector_quality": {
    "n_fail": 0,
    "n_warn": 0,
    "verdict": "pass",
    "acceptable": true,
    "query": "segment a CT NIfTI volume",
    "catalog_count": 28,
    "recommendation_count": 3,
    "top_id": "medagent.nv_segment_ct"
  },
  "checks": [
    {
      "name": "target_skill_matches",
      "status": "pass",
      "reason": "skill_id='medagent.find_skills'"
    },
    {
      "name": "source_pack_passed",
      "status": "pass",
      "reason": "source pack overall='passed'"
    },
    {
      "name": "query_present",
      "status": "pass",
      "reason": "query='segment a CT NIfTI volume'"
    },
    {
      "name": "catalog_count_positive",
      "status": "pass",
      "reason": "catalog.count=28, recommendations=3"
    },
    {
      "name": "recommendations_nonempty",
      "status": "pass",
      "reason": "recommendations=3"
    },
    {
      "name": "top_recommendation_is_first",
      "status": "pass",
      "reason": "top='medagent.nv_segment_ct', first='medagent.nv_segment_ct'"
    },
    {
      "name": "scores_sorted_desc",
      "status": "pass",
      "reason": "scores=[12, 12, 11]"
    },
    {
      "name": "no_fit_matches_top_score",
      "status": "pass",
      "reason": "no_fit=False, top_score=12"
    },
    {
      "name": "self_excluded",
      "status": "pass",
      "reason": "find_skills must not recommend itself"
    },
    {
      "name": "ct_nifti_fixture_top_match",
      "status": "pass",
      "reason": "expected='medagent.nv_segment_ct', actual='medagent.nv_segment_ct'"
    },
    {
      "name": "selection_scope_disclosed",
      "status": "pass",
      "reason": "disclaimer must preserve engineering-only and manifest-inspection scope"
    },
    {
      "name": "recommendation_0_manifest_exists",
      "status": "pass",
      "reason": "id='medagent.nv_segment_ct', path='skills/nv-segment-ct'"
    },
    {
      "name": "recommendation_0_id_matches_manifest",
      "status": "pass",
      "reason": "reported='medagent.nv_segment_ct', manifest='medagent.nv_segment_ct'"
    },
    {
      "name": "recommendation_0_kind_matches_path",
      "status": "pass",
      "reason": "reported='skill', expected='skill'"
    },
    {
      "name": "recommendation_1_manifest_exists",
      "status": "pass",
      "reason": "id='medagent.nv_segment_ctmr', path='skills/nv-segment-ctmr'"
    },
    {
      "name": "recommendation_1_id_matches_manifest",
      "status": "pass",
      "reason": "reported='medagent.nv_segment_ctmr', manifest='medagent.nv_segment_ctmr'"
    },
    {
      "name": "recommendation_1_kind_matches_path",
      "status": "pass",
      "reason": "reported='skill', expected='skill'"
    },
    {
      "name": "recommendation_2_manifest_exists",
      "status": "pass",
      "reason": "id='medagent.nv_segment_ct_finetune', path='skills/nv-segment-ct-finetune'"
    },
    {
      "name": "recommendation_2_id_matches_manifest",
      "status": "pass",
      "reason": "reported='medagent.nv_segment_ct_finetune', manifest='medagent.nv_segment_ct_finetune'"
    },
    {
      "name": "recommendation_2_kind_matches_path",
      "status": "pass",
      "reason": "reported='skill', expected='skill'"
    }
  ],
  "warnings": [],
  "overall": "pass"
}